{
  "schema": "tessera.report/1",
  "validator_version": "1.0.0",
  "generated_utc": "2026-07-25T16:47:09+00:00",
  "subject": "Survivor Safe House, Two Storey",
  "subject_kind": "layout",
  "status": "passed",
  "counts": {
    "errors": 0,
    "warnings": 0,
    "info": 6
  },
  "coverage": {
    "checks_run": [
      "layout.schema",
      "layout.space",
      "layout.catalog_pinned",
      "layout.asset_known",
      "layout.instance_ids_unique",
      "layout.grid",
      "layout.rotation_allowed",
      "layout.scale_allowed",
      "layout.intersection",
      "layout.support",
      "layout.grounded",
      "layout.connector.kind",
      "layout.connector.direction",
      "layout.connector.roll",
      "layout.connector.gap",
      "layout.connector.scale_class",
      "layout.aperture_clear",
      "layout.clearance",
      "layout.stair_usable",
      "layout.aperture_passable",
      "layout.reachability"
    ],
    "checks_run_count": 21,
    "rules_failed": []
  },
  "by_code": {
    "TSR_LAYOUT_APERTURE_OCCUPIED_BY_LEAF": 1,
    "TSR_LAYOUT_APERTURE_CLOSED": 1,
    "TSR_LAYOUT_REACHABILITY_PROVEN": 4
  },
  "diagnostics": [
    {
      "code": "TSR_LAYOUT_APERTURE_OCCUPIED_BY_LEAF",
      "severity": "info",
      "what": "Aperture is filled by its own leaf.",
      "where": {
        "instance": "wall_doorway_4m_01",
        "asset": "tsr:shell/wall.doorway.4m",
        "aperture": "door",
        "other_instance": "door_leaf_1m2_01",
        "other_asset": "tsr:shell/door.leaf.1m2"
      },
      "why": "The blocking instance is connected to this wall, so it is the door or window that belongs in the hole. The opening is closed but not obstructed.",
      "expected": "informational",
      "actual": "0.0888 m3 of the opening is occupied",
      "fix": "none needed; open the leaf if the route must be passable",
      "fix_transform": null,
      "rule": "layout.aperture_clear"
    },
    {
      "code": "TSR_LAYOUT_APERTURE_CLOSED",
      "severity": "info",
      "what": "Opening is closed, so it was not audited as a route.",
      "where": {
        "instance": "wall_doorway_4m_01",
        "asset": "tsr:shell/wall.doorway.4m",
        "aperture": "door",
        "position": [
          4.0,
          0.0,
          0.5
        ],
        "closed_by": "door_leaf_1m2_01"
      },
      "why": "A shut door is a legitimate state, not a defect, so passability is not asserted either way. Remove or open the leaf if this route has to be proven.",
      "expected": "informational",
      "actual": "occupied by door_leaf_1m2_01",
      "fix": "none needed",
      "fix_transform": null,
      "rule": "layout.aperture_passable"
    },
    {
      "code": "TSR_LAYOUT_REACHABILITY_PROVEN",
      "severity": "info",
      "what": "Route proven: terrain up the stoop to the threshold.",
      "where": {
        "claim": "terrain up the stoop to the threshold",
        "from": [
          6.0,
          -1.6,
          0.0
        ],
        "to": [
          6.0,
          -0.15,
          0.5
        ]
      },
      "why": "Checked by flood fill over the exact occupancy volumes.",
      "expected": "reachable",
      "actual": "route_found",
      "fix": "none needed",
      "fix_transform": null,
      "rule": "layout.reachability"
    },
    {
      "code": "TSR_LAYOUT_REACHABILITY_PROVEN",
      "severity": "info",
      "what": "Route proven: ground floor to mezzanine.",
      "where": {
        "claim": "ground floor to mezzanine",
        "from": [
          6.0,
          2.0,
          0.5
        ],
        "to": [
          6.0,
          10.0,
          3.7
        ]
      },
      "why": "Checked by flood fill over the exact occupancy volumes.",
      "expected": "reachable",
      "actual": "route_found",
      "fix": "none needed",
      "fix_transform": null,
      "rule": "layout.reachability"
    },
    {
      "code": "TSR_LAYOUT_REACHABILITY_PROVEN",
      "severity": "info",
      "what": "Route proven: mezzanine back down to the ground floor.",
      "where": {
        "claim": "mezzanine back down to the ground floor",
        "from": [
          6.0,
          10.0,
          3.7
        ],
        "to": [
          2.0,
          2.0,
          0.5
        ]
      },
      "why": "Checked by flood fill over the exact occupancy volumes.",
      "expected": "reachable",
      "actual": "route_found",
      "fix": "none needed",
      "fix_transform": null,
      "rule": "layout.reachability"
    },
    {
      "code": "TSR_LAYOUT_REACHABILITY_PROVEN",
      "severity": "info",
      "what": "Route proven: outside cannot reach the mezzanine except through the house.",
      "where": {
        "claim": "outside cannot reach the mezzanine except through the house",
        "from": [
          14.0,
          14.0,
          0.0
        ],
        "to": [
          6.0,
          10.0,
          3.7
        ]
      },
      "why": "Checked by flood fill over the exact occupancy volumes.",
      "expected": "not reachable",
      "actual": "no_route",
      "fix": "none needed",
      "fix_transform": null,
      "rule": "layout.reachability"
    }
  ],
  "connections": {
    "declared": 36,
    "verified": 36
  }
}